ID,Title,Location,Salary,Summary
https://kr.indeed.com/viewjob?jk=b16367694b400bf6,컨텐츠 API 서버 개발자 (경력),카카오 4.2 성남 판교역,,서버 개발 지원자격 지원자격 개발 경력 2년 이상 java 언어에 익숙하신 분 JVM에 대한 이해 Spring Framework 경험자 Linux/Network 기반 지식 동료와 함께 목표를 달성하실 분 우대사항...
https://kr.indeed.com/viewjob?jk=efa2762e61726c34,[기술플랫폼실] 데이터 어플리케이션 개발자 영입,카카오페이 성남 분당구,,전산 관련학과 학사 이상 또는 동일한 자격을 보유하신 분 - Java 언어 활용 능력을 보유하신 분 - Spring Framework 프레임워크 활용 능력이 있으신 분 - OOP 또는 Functional Programming...
https://kr.indeed.com/viewjob?jk=a5f72db70e317024,콘텐츠 구독 서비스 개발자 (경력),카카오 4.2 성남 판교역,,"알고리즘, 자료구조, OOP) 기초 지식 필수 생산적이고 유쾌한 커뮤니케이션 기술을 가진 분 Java & Spring Framework 기반 웹서비스 개발 경험 Linux 플랫폼에서 웹 서비스 개발/운영 경험 MySQL 또는..."
https://kr.indeed.com/viewjob?jk=d99e03f875abe7ce,NXLog리포트팀 - 웹 프로그래머,Nexon 성남 분당구,,"TypeScript, JavaScript - Framework : Spring Boot, Angular - Build Tool : Gradle... Angular, Vue 등) - Spring Boot 로 서비스를 개발해..."
https://kr.indeed.com/viewjob?jk=bd2d072d35d7da4e,[중급/JAVA/7개월/서판교/Spring/JSP/JavaScript/M...,한국프로골프투어 성남 분당구,,"중급/JAVA/7개월/서판교/ Spring/JSP/JavaScript... UI개발, 웹서버개발 나. API연동 4. 우대사항 가. JAVA/ Spring/JSP/JavaScript/JQuery/MariaDB/HTML/CSS..."
https://kr.indeed.com/viewjob?jk=4a68fa9e002e0953,[그룹사] 멤버십 운영 (대리/과장),BOB네트웍스 서울 강남구,,전문학사(전문대) 이상. / - 총경력: 5년~ 선호 - (Oracle 기반) 멤버십 운영 경력자 - Spring F/W 기반 개발 경력자 - 개인정보 라이프 싸이클 관리 경력자 우대 - X- platform 개발 경험자...
https://kr.indeed.com/viewjob?jk=a5df2a689ce4021f,[NHN ACE] 시스템/플랫폼 개발자 경력,엔에이치엔에이스 성남 분당구,,"니어] Job Description 자격요건 우대사항 - 수집/분석/활용 시스템/플랫폼 개발 - Java( Spring)/Linux 개발 경력자 - DBMS, NoSQL, ETL 작업 가능한자 - 빅데이터 기반 수집/분석/활용..."
https://kr.indeed.com/viewjob?jk=3190803dba63c314,동영상 데이터/비즈 플랫폼 서버 개발자,카카오 4.2 성남 판교역,,"동영상 광고 서버 개발 동영상 데이터 수집/분석 지원자격 기본 조건 Java 개발 경력 2년 이상 Spring Framework 기반 웹 애플리케이션 개발 경험 MySQL, MongoDB 등의 DB 개발 경험 우대조..."
https://kr.indeed.com/viewjob?jk=9d6f0caa84cb9a3f,커머스 플랫폼 개발 (프론트엔드 엔지니어),LINE Plus corporation 성남 서현역,,"Ajax 등을 통한 비동기 처리와 MVVM, MVP 패턴에 대한 이해 - Java 언어에 능숙하고, Spring Framework 기반 개발에 익숙한 분 - 해외 출장에 결격 사유가 없는 분 [우대사항] - HTTP..."
https://kr.indeed.com/viewjob?jk=314cb11dce58741e,서버 웹 애플리케이션 개발,픽셀로 경기도 의왕,,"회사 서버 웹 애플리케이션 개발... Web Application Server) 개발 - Java/ Spring, Html/css/Node.js/javascript - RDBMS - Mobile app & Server..."
https://kr.indeed.com/viewjob?jk=02e6b7511ba4ced4,"웹개발자 (java,spring)",에스엔아이디 서울 노원구,"연봉 22,000,000원 - 24,000,000원","Jquery, UI 라이브러리 - MSSQL, MARIA, ORACLE, MYSQL [우대사항] - java ( spring boot, mybatis, JPA)) - Angular 7 - Angular JS - Node JS..."
https://kr.indeed.com/viewjob?jk=e65a195da656bcdc,[동영상플랫폼] 연계형 인턴십,네이버 서울,,"경험 - Java, Spring Framework 환경 개발 경험 [ 우대사항 ] - 오픈소스 활용에 대한 경험이 풍부하신 분 - SpringBoot, Cloud, Batch 등 다양한 Spring 모듈 사용 경험..."
https://kr.indeed.com/viewjob?jk=27b10c6deb91477e,팟티서비스 웹개발(서버&프론트),아프리카TV 성남 분당구,,[담당업무] - 팟티서비스 PC/모바일 웹 서비스 개발 및 유지보수 [자격요건] 서버 - JAVA & Spring Framework 기반 웹서비스 개발 3년 이상이신 분 - Linux 플랫폼에서 웹서비스 개발/운영 경험...
https://kr.indeed.com/viewjob?jk=5771fa5d8d4ced04,[LS글로벌] SAP MM / MES시스템 운영 경력직,엘에스글로벌인코퍼레이티드 서울 용산구,,"개발,수정), jqWidget Object 개발 경험 - java 개발 : API개발, 추가 모듈 개발 등 - spring-framework 이해(glue-framework의 기본 사상) 2. DBMS - PPAS sql..."
https://kr.indeed.com/viewjob?jk=422dc50fab786fd2,"부문별 경력 (MD,자바개발자)",아이마켓코리아 서울 강남구,,JSP 개발경력 4년이상 · ORACLE DB 사용 경험자 · 쇼핑몰 운영 개발 경력자 [우대사항] · Spring framework 사용 경험자 우대 · 모바일웹 개발 경력자 우대 · 전산관련 자격증 소지자 우대 (정보처리...
https://kr.indeed.com/viewjob?jk=af8f5789b3e87df6,8 WEEKS VACATION | Homeroom Teachers | A...,MICA International Scholars 경기도 용인,,"included. Holidays/Vacation: 8 Weeks Total, all paid Spring Break - 1 Week, Summer + Winter Break - 3 Weeks, Including..."
https://kr.indeed.com/viewjob?jk=5e7504a283c851a0,API 테스트 플랫폼 개발자,카카오 4.2 제주도,,"있으신 분 DevOps, CI/CD 등에 관심 있으신 분 소프트웨어 품질, 코드 품질에 관심 있으신 분 Spring 등 프레임워크에 대한 경험과 이해가 있으신 분 <우대조건> 플랫폼 설계/개발 역량이 탁월하신 분 프론트..."
https://kr.indeed.com/viewjob?jk=1024c16050f5a67a,(퇴직기술인력 중소기업활용) 의료용 소프트웨어 개발 경력직,아이알엠 서울 강남구,"연봉 40,000,000원 - 42,000,000원","서버 개발자 . 주요 업무: 당사에서 구축한 플랫폼 운영 및 개발 . 자격 요건: Python, Java( Spring, CXF, Maven) 개발 가능자, API 개발 및 설계 가능자, PostgreSQL 사 용 가능자..."
https://kr.indeed.com/viewjob?jk=8df6e7918b4eb045,커머스 플랫폼 개발 (서버 엔지니어),LINE Plus corporation 성남 서현역,,"가능한 플랫폼 구축 [자격요건] - Java 언어에 능숙하고, Spring Framework 기반 개발에 익숙한 분 - RDBMS 및 NoSQL... Streams, Avro, Spring Cloud Data Flow..."
https://kr.indeed.com/viewjob?jk=ed01858a0804bd1d,2020 박사,세메스 천안 서북구,,"Platform 개발 Server 개발 - Java, JSP 기반 web 및 API 개발 - Spring, Springboot, Mybatis 개발 - MySQL DB설계 및 SQL 개발 컴퓨터/전산/산업공..."
https://kr.indeed.com/viewjob?jk=6e762e911554314a,모바일 앱 서버/백엔드 개발자,흐름 서울 성산동,,진행한 후 UML을 작성합니다. Spring Framework를 이용하여... 으신 분 - 자바에 익숙하고 기타 언어 하나 이상을 습득하신 분 - Spring 프레임웍을 이용한 Web Application 개발 경험이 있으신 분...
https://kr.indeed.com/viewjob?jk=3fe823bafcdcf478,Blockchain Platform 개발 / 분산 플랫폼 개발,알투브이 서울 영등포구,,"스탠드업미팅, 스프린트 - JUnit, Mockito 등을 활용한 유닛테스트 작성 경험 - JAVA 8, Spring Framework를 통한 어플리케이션 개발 경험 - 영어 의사소통 능력 - 블록체인 프로젝트 진행 경험..."
https://kr.indeed.com/viewjob?jk=00a93640285a62a6,서버(java/spring) 개발 경력직,인더스웰 서울 강남구,,"[웹프로그래밍] - jsp, java, ASP / PHP 개발 능숙자 - HTML, JavaScript, css 능숙자 - MS SQL, Oracle, MySQL 등 DBMS 설계 및 운영 가능자 - 웹, DB서버 구축 및..."
https://kr.indeed.com/viewjob?jk=f28daf14149c1eec,loT플랫폼/웹서비스 개발 경력 정규직,심시스글로벌 서울 서초구,,"Spring/Webflux 활용한 웹 개발 경험 ㆍ오픈소스 활용 경험 (Netty, MQTT Broker, kafka, RDBMS, NoSQL DB 등) ㆍDBMS 경험 ㆍWEB/WAS 설정 및 튜닝 경험 ㆍ Spring..."
https://kr.indeed.com/viewjob?jk=a595c08ccccac67d,커뮤니티서비스 웹개발,아프리카TV 성남 분당구,,"Mysql,javascript, Linux 등 웹서비스 개발 지식과 경험이 있으신 분 - laravel, Spring, React, Hadoop, Hbase, Elasticsearch, Redis 활용이 가능하신 분..."
https://kr.indeed.com/viewjob?jk=e2af10f5682263b8,웹/응용 프로그래머,바스코에너지 경기도 부천,,"웨어 연구개발, 구축> - 에너지관리시스템 솔루션 개발 및 구축 업무 - 관련 웹 개발자 - C# 또는 자바( Spring), 기타 언어 기반 SW 개발자 [근무시간 및 형태] 주 5일 근무 (오전) 9시 00분~(오후) 6시..."
https://kr.indeed.com/viewjob?jk=6240019d0b1ca8e6,백오피스 개발자,쏘카 대한민국,,"분 • 논리적이고 분석적인 사고력을 갖추신 분 • 빠른 지식 습득 능력을 보유하신 분 우대사항 • PHP, Spring Boot, Kotlin 등에 익숙하신 분 • Vue.js 등 프론트엔드 프레임워크 사용에 익숙하신 분..."
https://kr.indeed.com/viewjob?jk=6ae4ed1bba95fed4,서버개발자,쏘카 대한민국,,"있으신 분 • 논리적이고 분석적인 사고력을 갖추신 분 • 빠른 지식 습득 능력을 보유하신 분 우대사항 • Spring Boot, Kotlin 등에 익숙하신 분 • CloudFormation, Terraform 등을 사용한..."
https://kr.indeed.com/viewjob?jk=29c738b1f02af63d,"Java Spring 개발자 , 면접비 지급",클라모스 서울 구로구,,(주)클라모스 Java Spring 개발자 모집 모집부문 및 자격요건 담당업무 자격요건 인원 [담당업무] - Java Spring을 이용한 서버 및 클라이언트 개발 - Java Spring을 이용한 Back-End 개발...
https://kr.indeed.com/viewjob?jk=44bfd56f822a70f3,서버팀 팀장,쏘카 대한민국,,"개발에 대한 깊은 이해가 있으신 분 우대사항 • AWS, Kubernetes, Docker에 익숙하신 분 • Spring Boot, Kotlin 등에 익숙하신 분 • CloudFormation, Terraform 등을 사용한..."
https://kr.indeed.com/viewjob?jk=68875cf86f31569e,ERP 담당자 모집,넷마블 서울 구로구,,"관리 및 수행 자격요건 - SAP기반 ERP Web Portal 시스템개발/운영 경력 3~9년 보유자 - Spring (혹은 .NET, Python 등) 프로그래밍 가능자 - 시스템 분석/설계 가능자 - 재무/회계 기본..."
https://kr.indeed.com/viewjob?jk=516001554380a268,11번가 가격비교 서비스 Tool 개발 분야,십일번가 서울 강남구,,"입사 직무 키워드 java, spring, JPA, python 담당 직무... 용성 개선 - 지속적인 서비스 구조 개선 자격 요건 - Java & Spring Framework 기반 웹서비스 개발 경험 3년 이상 - RDB 이용..."
https://kr.indeed.com/viewjob?jk=e290724a4ccb433a,파생상품 거래소 백엔드 개발자,알투브이 서울 영등포구,,"학력/전공 무관 • 애플리케이션 개발, 운영 경험자로서 실무 3년차 이상 또는 그에 준하는 역량 보유자 • Spring 프레임워크를 이용한 Batch Application 개발 경험 • 동시성 프로그래밍에 대한 기본적인 이해..."
https://kr.indeed.com/viewjob?jk=500ddbde6187459a,정규직 소프트웨어 개발 경력직 채용,네오하이테크 경기도 군포,,"query 작성능력 필요) - 정보처리기사 - 도서관 시스템(LAS) 개발 경험 -JAVA, JSP, Spring, Axisj등 웹개발경험 -개발문서 작성경험 근무조건 - 근무형태 : 정규직 - 근무지역 : 경기..."
https://kr.indeed.com/viewjob?jk=42e5fca49d726803,[수시] ESTsoft 웹서버개발 (신입/경력),이스트소프트 서울 서초구,,팀업 제품 개발 - 신사업 제품 개발 - 알툴즈 제품 개발 및 유지보수 자격조건 - Spring Framework에 대한 이해가 있는 분 - Rest API에 대한 이해가 있는 분 - DB(RDBMS...
https://kr.indeed.com/viewjob?jk=5352cf066e6ae2cc,여행 좋아하는 경력직(4년 이상) 개발자,메리홀리데이 서울 강남구,,"원활한 소통은 필수입니다. [어떤 사람을 우대하나요?] · 스타트업 경험자 · Node.js, JAVA/ Spring Framework 등 백엔드 개발 경험자 · iOS 또는 하이브리드 앱개발 경험자 (xcode, swift..."
https://kr.indeed.com/viewjob?jk=b64e827134b2a4c2,[다음카페] 서버 개발자 (경력),카카오 4.2 성남 판교역,,"책임감을 가지는 분 '다음카페' 백엔드 시스템은 대부분 Java 와 Spring Framework, RDB 기반의 웹어플리케이션입니다. 이 기술들에... 2년 이상 경험 Java & Spring Framework, Kotlin..."
https://kr.indeed.com/viewjob?jk=f2fcd4138df16309,JAVA 신입개발자 정규직,리얼아이브이 서울 송파구,,"무부서: 연구개발부서 직급/직책: 팀원 [자격요건] - 비대면 서비스에 공감하시는 분 [우대사항] - 자바 Spring framework 활용한 개발 경험 - 정보통신학, 컴퓨터공학 등 관련 학과 출신 - Docker를 사용..."
https://kr.indeed.com/viewjob?jk=6a49ea76da8d2265,"서버개발자(주니어, 시니어)",넥스트매치 서울 서초구,,"서버개발자(주니어, 시니어) - Ruby on Rails 개발자 - PHP/CodeIgniter 개발자 - Java Spring 개발자 - AWS 서비스 운영 경험자 - MySQL, Postgre, Redis 경험자 Nextmatch..."
https://kr.indeed.com/viewjob?jk=9131e46dace78965,Software Engineer (Blockchain Platform B...,LINE Plus corporation 성남 서현역,,"Java 또는 Kotlin 언어에 능숙하고, Java Framework 기반 개발에 능숙한 분 - Spring 라이브러리를 프로젝트에 사용한 경험이 있으신 분 - Linux 환경하에 개발, 시스템 운영에 익숙한 분..."
https://kr.indeed.com/viewjob?jk=b2ec38066f8cb14a,(주)케이에스넷 신입 및 경력사원,케이에스넷 서울 강남구,,"js 등 개발 예정 - Back-end : 현재 C(Tmax), Java로 개발되어 있으며, Java( Spring) 기반으로 개발 예정 [희망 인재상] - 개발하는 것 자체에서 행복을 느끼는 사람 - 지속적인 기술 연구 및..."
https://kr.indeed.com/viewjob?jk=4cc84af7e309b14f,[세종시소재] 정보보호 소프트웨어 개발/보안컨설팅 수행인력,시큐리티캠프 대한민국,"연봉 28,000,000원 - 30,000,000원","이해도가 높은 분 - 반응형 웹 디자인 경험을 보유하신 분 Back-end 개발자 - Spring Framework 또는 Spring Boot를 이용한 서비스 개발 경험을 보유하신 분 [우대 사항] - AWS, Azure..."
https://kr.indeed.com/viewjob?jk=a1d4ca2102fb8414,웹개발 CTI 솔루션 엔지니어 Network Management Syst...,IoT 통합 플랫폼 / 무인경지 관제 솔루션 / 위치관제 솔루션 / 헬스케어 솔루션 / 컨... 서울 구로구,,"SI 구축 웹 개발 - 근무지 : 서울 전역 - 자바 기반 프레임워크( spring, myBatis) 경험자 - 모집 인원 : 5 인 - 경력 : 4... 연동 • 지원자격 - Java & Spring framework 환경 기반..."
https://kr.indeed.com/viewjob?jk=cd88d84c85be0dda,모바일게임 플랫폼 서버 개발자,Nexon 성남 분당구,,"서버 및 백오피스 개발 지원자격 - 컴퓨터 관련 전공자 또는 이에 준하는 지식을 보유하신 분 - Java & Spring 개발 경험 - 새로운 기술에 대하여 흥미와 열정이 있으신 분 우대사항 - Vue, Angular..."
https://kr.indeed.com/viewjob?jk=b13ab6d9c9ddb6a4,8 Weeks Vacation | Art Teacher | America...,MICA International Scholars 경기도 용인,,"experience) Benefits Holidays/Vacation: 8 Weeks Total Spring Break - 1 Week, Summer + Winter Break - 3 Weeks, Including..."
https://kr.indeed.com/viewjob?jk=723b7aa9cb5ea28f,네이버 메인플랫폼 프론트엔드 개발자,네이버 서울,,"Toolkit(Redux) / Redux Saga - Webpack / Babel / Jest - react- spring - Storybook [우대사항 ] - 프론트엔드 성능 튜닝 경험 - 컴포넌트, 라이브러리 개발 경험..."
https://kr.indeed.com/viewjob?jk=0ebde768f98f227f,서버 프로그래머,펀플로 서울 구로구,,Database 에 대한 기본 지식 보유 Network 에 대한 기본 지식 보유 [우대 조건] Java Spring Framework 유 경험자 Linux 환경 유 경험자 대용량 서버 구축에 대한 유 경험자 WCF 유 경험자
https://kr.indeed.com/viewjob?jk=e7bede7841f3aeae,웹/앱 프론트엔드 개발자,에이치랩 서울 마포구,"연봉 30,000,000원 - 32,000,000원","flutter, reactnative (1개 이상 유경험자) 우대사항 - php, java, python, spring boot, node.js, my-sql, mariaDB, ms-sql 관련 지식 보유 상세모집요강..."
https://kr.indeed.com/viewjob?jk=4ef11c99c86a7be9,B2C서버 자바 개발자 경력사원,GS ITM 서울 종로구,,자바 개발자 [담당업무] - GS칼텍스 자바 서버 개발자(SM) [자격요건] - Java/ Spring Framework/ Spring boot/Mybatis (Java 기반 WebApp/REST API 개발) - RDBMS...
https://kr.indeed.com/viewjob?jk=b4e96a7dcac2f50a,인프라 서비스 플랫폼 개발자,카카오 4.2 성남 판교역,,"랫폼 개발 인프라 서비스의 클라우드 트랜스포메이션 개발 지원자격 필수 자격 개발 경력 만 5년 미만 - Spring Framework 기반 웹 애플리케이션 개발 경험 (신입, 경력 무관) -Javascript SPA 기반..."
https://kr.indeed.com/viewjob?jk=8b48e3177a2f2056,"[다음메일/카카오메일] (경력) 서버, iOS 개발자",카카오 4.2 성남 판교역,,제어 설계 및 구성 고효율 아키텍처 설계 및 반영 지원자격 ✔︎ Java 기반 서버 개발 Java & Spring Framework 기반 웹서비스 개발 경력 (5년 이하) Linux 플랫폼에서 웹 서비스 개발/운영 경험...
https://kr.indeed.com/viewjob?jk=76772e88175f63d3,Spring 개발 경력자,에이원그룹 경기도 부천,"연봉 24,000,000원",경기도 부천시 부천로3번길 8층 806호 인근지하철 직무내용 - 3년이상의 Java개발 경력 - Java/ Spring 환경에서 RESTful 서비스 개발 경험 3년 이상 - SQL/DBMS/ORM 에 대한 이해 - AWS...
https://kr.indeed.com/viewjob?jk=013711cc91044486,IT본부 신입/경력,유안타증권 대한민국,,"3년 이상(대리~과장급) · 국내, 해외 파생상품 백오피스 개발 운영 경험자 · Java, Mipatform, Spring기반 Framwork, C, Oracle DBMS 프로그램 경험자 IT본부(Prop Trading..."
https://kr.indeed.com/viewjob?jk=1ef27458faf54339,유니메오에서 함께할 백엔드 [경력 ] 개발 인재,유니메오 서울 서초구,"연봉 36,000,000원 - 38,000,000원","지원자격 경력 신입·경력 학력 - 성별 무관 기타 담당업무 [담당업무] -Java, Spring기반 서버개발 [자격요건] -Java, Spring기반 서버Application 개발 및 운영경험 -서버와 클라이언트 간 RESTful..."
https://kr.indeed.com/viewjob?jk=e339b300b84379be,[룰루랩-삼성전자c-lab] 백엔드 서버 개발자 경력,룰루랩 서울 강남구,,"성별 : 무관 - 모집인원 : 1명 [직무우대역량 (지식, 스킬, 태도)] - Java Spring F/W, Java Spring Boot, JPA (필수) - AWS 개발환경 (필수) - 3년 이상의 웹 어플리케..."
https://kr.indeed.com/viewjob?jk=2a4a3b2073e02c15,음악인식(음악검색/저작권) 서버 개발자,네이버 서울,,개발 경력 2년 이상 (플랫폼 및 언어 무관) - 컴퓨터 과학의 기초 지식을 보유하신 분 - Java / Spring 기반 개발 가능한 분 [우대사항 ] - 오디오 도메인에 대한 이해 및 개발 경험 - C/C++에 대한...
https://kr.indeed.com/viewjob?jk=a7ad2455872da832,[카카오스토리] 개발자 (서버),카카오 4.2 대한민국,,서버 개발 및 운영 지원자격 Java 서버 개발 2년 이상 Java Spring framework 를 이용한 서버 개발 경험 객체지향 설계 및 구현... 운영 경험 우대사항 Java Spring framework 를 이용한...
https://kr.indeed.com/viewjob?jk=4d644ac8def66bad,8 WEEKS VACATION PE and Elementary Homer...,MICA International Scholars 경기도 용인,,"based on experience) Holidays/Vacation: 8 Weeks Total Spring Break - 1 Week, Summer + Winter Break - 3 Weeks, Including..."
https://kr.indeed.com/viewjob?jk=2c282ae7cf933e8c,(주)이랜서 웹 개발자 인재 초대 (정규직/본사근무),이랜서 서울 강남구,,"CSS3)가능 - 커뮤니케이션 우수자 우대조건 - Python 가능자 - Java기반 웹 기술 보유( Spring, JSP등) - iOS, Android 개발 경험자 - 웹 접근성 / 반응형 웹 경험자 - IT 관련학과 출신..."
https://kr.indeed.com/viewjob?jk=e8e60d7b06fd0aa0,개발자(백엔드),레이즈지엘에스 서울 서초동,,"3년 이상해본 분이면 좋겠습니다. Spring 3.X 개발 경험이 필요해요... 셨던 분 현재 서비스 개발 스택 백엔드: 구글 앱엔진 / Java 7, Spring 3.X / 데이터스토어(NoSQL) 프론트: React(0.13..."
https://kr.indeed.com/viewjob?jk=8a1b8c186acc2892,[정규직] SK 가스 Retail 마케팅 플랫폼 사업개발 및 구축인력 요...,SK 씨앤씨 4.0 서울,,"스킬 - 관계사 b2c 시스템 aa 경험 우대 - 개발언어 : java, spring, jspq- orpro*c - m/w : jeus, webtob... 개발언어 : java, spring, jsp - M/W : Jeus..."
https://kr.indeed.com/viewjob?jk=a94d025441879ed9,[2020년 수도권 혁신기업 온라인 박람회]엠아이큐브솔루션(주) 2020...,엠아이큐브솔루션 서울 서초구,,"Flask를 이용한 벡엔드 개발 경험자 R&D 연구원(플랫폼개발) ㆍ 경력 2년 이상 ㆍ 기술사항 Java, Spring, Html, javascript, JDBC, No-SQL, Eclipse, Oracle, C# 등 ㆍ..."
https://kr.indeed.com/viewjob?jk=f3a14b3f8d9e3e12,네이버 쇼핑검색플랫폼 개발자,네이버 서울,,"React로 서비스 구현 - Spring등의 프레임워크 기반 서비스 구현... 어느 한가지를 능숙하게 다룰 수 있는 분 [ Java, Python, Spring boot/batch/cloud, Kotlin, React, Vue..."
https://kr.indeed.com/viewjob?jk=7d968159951e068b,네이버 메인플랫폼 백엔드 개발 연계형 인턴십,네이버 서울,,"Git, Community 활동 등) - 새로운 분야를 연구하고 배우며 성장할 수 있는 분 - Java, Spring, Backend, Database, Cache 등 개발에 친숙하신 분 전형절차 및 기타사항 1 전형절..."
https://kr.indeed.com/viewjob?jk=86ea268d9852807f,[경력] 검색 엔진 개발,현대엠엔소프트 서울 용산구,,"설계/개발 [기술 스택] - OS: Linux - 개발 언어/framework: JAVA, Python, Spring boot - Tool: IntelliJ, STS, JIRA/Confluence, GIT, Jenkins 등..."
https://kr.indeed.com/viewjob?jk=14905eb509bf91e2,웹기반 금융 플랫폼 개발 팀장님,핀투비 서울 여의도,,"비티, 서로 존중하는 문화 주요 업무 • 웹기반 B2B 금융 플랫폼 개발 리드 기술스택 • back-end ( spring, jpa, mybatis, nodejs, express, mocha, aws, mysql, nginx..."
https://kr.indeed.com/viewjob?jk=506b78300bd1dd49,웹개발&응용프로그램개발 담당자,아홉 서울 중구,"월급 1,600,000원 - 1,800,000원","ㆍ학력 : 무관 ㆍ나이/성별 : 무관 프로그래머 3명 담당업무 ㆍJAVA 기반 Web Applction( Spring) 개발,RESTful API 설계/구현,RDBMS를 활용한 서비스 구현 지원자격 ㆍ경력 : 무관 (신입도..."
https://kr.indeed.com/viewjob?jk=3bafdba72ed14ee9,다음 첫화면/뉴스/스포츠/연예/1boon 유저 웹서비스 개발자 (경력),카카오 4.2 성남 판교역,,"경험자 docker, kubernetes 등 클라우드 환경 사용 경험 JVM과 그 생태계에 대한 이해와 경험 Spring Framework 기반 웹 애플리케이션 개발 경험이 있으신 분 HTML, CSS의 이해 ES2015+의..."
https://kr.indeed.com/viewjob?jk=843fd941fa6b0b53,8 Weeks VACATION International Curriculu...,MICA International Scholars 경기도 용인,,"based on experience) Holidays/Vacation: 8 Weeks Total Spring Break - 1 Week, Summer + Winter Break - 3 Weeks, Including..."
https://kr.indeed.com/viewjob?jk=5b30f6a2b70215f5,[개발]위메프 서버개발자(정규직),위메프 2.8 대한민국,,"원더페이, 원더쇼핑 등 신사업 개발 [자격사항] - Java / Spring 서버 개발 경력 5년 이상자 - Spring framework, Spring Data JPA 경험자 - API 개발 경험자 - RDB기반 서비스..."
https://kr.indeed.com/viewjob?jk=dfcb86f156623e5c,보훈대상자 인재 채용,네오위즈 대한민국,,동을 위한 인터페이스 개발 및 운영 [자격요건] - 3년 이상의 JAVA 기반 개발 경력이 있는 분 - Spring framework 기반의 개발 경험이 있는 분 - Linux 및 Unix를 능숙하게 사용하는 분 [우대...
https://kr.indeed.com/viewjob?jk=04b5029ddb9cdea9,네이버 메인플랫폼 백엔드 개발자,네이버 서울,,"개선 - '내서랍'(네이버 알림) 서비스 개선 [필요기술 ] - 2년 이상의 웹서비스 개발 경력 - Java( Spring, SpringBoot) - Maven, Gradle - MariaDB 등 RDBMS, MongoDB..."
https://kr.indeed.com/viewjob?jk=736eb193e417cee2,비즈개발실 서버 개발자 (경력),카카오 4.2 대한민국,,"1년 이상 (필수) Spring, Spring Boot, JPA 개발 경험... 우대) webView내에서 동작하는 모바일웹개발 경험 (우대) Spring, Spring boot 사용에 능숙 (우대) 대용량 트래픽 서비스 개발및..."
https://kr.indeed.com/viewjob?jk=49994ff4c66c566c,[경력] 데브옵스개발 담당자,다나와 서울 양천구,,"옵스(devops) 환경 구축 및 품질향상 - 경력 1~7년 - Java, Python에 대한 이해보유자 - Spring Boot 또는 Express.js 프레임워크 이해 보유자 제출서류 - 신입의 경우, 최종학교 졸업증명서..."
https://kr.indeed.com/viewjob?jk=4202da514d6cda33,웹/어플리케이션 개발자 경력,제이떠블유커리어 서울 강남구,,"업무 자격요건 인원 [담당업무] 1) Database 설계 (MySQL) 2) RESTful API 개발 ( Spring, Java) 3) AWS 인프라 관리 (ECS, S3, RDS [근무부서 및 직급/직책] 근무부서: 신성..."
